<?xml version="1.0" encoding="UTF-8"?>
<xs:schema xmlns:xs="http://www.w3.org/2001/XMLSchema" elementFormDefault="qualified" targetNamespace="http://www.intalio.com/vmware/session" xmlns:session="http://www.intalio.com/vmware/session">
  <xs:element name="session">
    <xs:complexType>
      <xs:sequence>
        <xs:element minOccurs="0" maxOccurs="unbounded" ref="session:argument"/>
        <xs:element minOccurs="0" maxOccurs="unbounded" ref="session:activity"/>
      </xs:sequence>
    </xs:complexType>
  </xs:element>
  <xs:element name="argument">
    <xs:complexType>
      <xs:simpleContent>
        <xs:extension base="xs:NCName">
          <xs:attribute name="name" use="required" type="xs:NCName"/>
        </xs:extension>
      </xs:simpleContent>
    </xs:complexType>
  </xs:element>
  <xs:element name="activity">
    <xs:complexType>
      <xs:sequence>
        <xs:element minOccurs="0" maxOccurs="unbounded" ref="session:activity"/>
        <xs:element minOccurs="0" maxOccurs="unbounded" ref="session:argument"/>
      </xs:sequence>
      <xs:attribute name="name" use="required" type="xs:NCName"/>
    </xs:complexType>
  </xs:element>
</xs:schema>
